<?xml version="1.0" encoding="UTF-8"?>
<nyilvantartas xmlns:xsi="http://www.w3.org/2001/XMLSchema-instance" xsi:noNamespaceSchemaLocation="megrendeles.xsd">
  <ettermek>
    <etterem eid="0">
      <nev>Arany Hollo</nev>
      <weblap>www.aranyhollo.hu</weblap>
      <minosites>****</minosites>
      <telefonszam>06703237436</telefonszam>
    </etterem>
  </ettermek>
  <etelek>
    <etel etid="0">
      <nev>Aranygaluska</nev>
      <ar>800</ar>
      <allergenek aid="0">
        <allergen>Tej</allergen>
      </allergenek>
      <leiras>Aranygaluska ahogy nagyszüleink készítették!</leiras>
    </etel>
  </etelek>
  <dolgozok>
    <dolgozo did="0">
      <nev>Szorgos János</nev>
      <beosztas>konyhafőnök</beosztas>
      <cim>
        <irsz>3580</irsz>
        <varos>Tiszaujvaros</varos>
        <utca>Szent István utca</utca>
        <hazszam>10.</hazszam>
      </cim>
      <telefonszam>06317564736</telefonszam>
    </dolgozo>
  </dolgozok>
  <rendezvenyek>
    <rendezveny rid="0">
      <idopont>2019-12-05</idopont>
      <cim>
        <irsz>3508</irsz>
        <varos>Hejőcsaba</varos>
        <utca>Gárdonyi út</utca>
        <hazszam>20.</hazszam>
      </cim>
    </rendezveny>
  </rendezvenyek>
  <megrendelesek>
    <megrendeles etterem="0" rendezveny="0">
      <ar>180000</ar>
    </megrendeles>
  </megrendelesek>
</nyilvantartas>
